{
  "schema": "sirsi.stacklab.wing.v1",
  "id": "stacklab.wing.maat",
  "owner": "Ma'at — QA Sovereign (software steward: sirsi-software-admin; hardware coordination: sirsi-hardware-admin; custodian: owner)",
  "project_id": "sirsi-pantheon",
  "router_namespace": "maat",
  "class": "control-plane",
  "scope": "Quality, truth, and order governance: the Ma'at pre-push/CI gate (A28), the Feather-Weight quality score (A17), Stack Lab measurement guards, incident intelligence and recurrence prevention, and the metal reservation scheduler that admits, schedules, and de-conflicts shared machine and rail usage across every lane. Its local System One Casebook canonically projects recorded assessments, allocation decisions, evidence, actors, and resources for every Pantheon installation without requiring an LLM or external service. Ma'at judges and governs; it does NOT own the code, engines, transport, or hardware it measures.",
  "status": "active",
  "first_gate": "MAAT-WING-001.G1",
  "workspace": {
    "repository_root": "/Users/thekryptodragon/Development/sirsi-pantheon",
    "writable_roots": [
      "/Users/thekryptodragon/Development/sirsi-pantheon/docs/qa",
      "/Users/thekryptodragon/Development/sirsi-pantheon/internal/maat"
    ],
    "evidence_root": "/Users/thekryptodragon/Development/sirsi-pantheon/docs/evidence/maat",
    "shared_payload_access": "none",
    "boundary_policy": "default-deny"
  },
  "handoffs": {
    "inbound": "router-receipt-only",
    "outbound": "router-receipt-only",
    "allowed_peer_wings": [
      "stacklab.wing.ra-horus-fabric",
      "stacklab.wing.io-connect",
      "stacklab.wing.sne-engine",
      "stacklab.wing.hardware-estate"
    ]
  },
  "provenance": {
    "lifecycle_task_id": "maat-wing-v1",
    "component_catalog": "docs/qa/MAAT_SYSTEM_ONE_CATALOG.md",
    "receipt_links": [
      "sirsi-stacklab:canon/docs/engineering/MAAT_INCIDENT_INTELLIGENCE_AND_RECURRENCE_POLICY.md",
      "sirsi-stacklab:canon/docs/engineering/MAAT_GUARD_STACKLAB_LOAD_FILTER_SELF_INTERFERENCE_20260916.md",
      "sirsi-stacklab:canon/docs/engineering/MAAT_GUARD_STACKLAB_MEASURE_ON_VERIFIED_SHA_20260917.md",
      "sirsi-stacklab:canon/docs/engineering/MAAT_FAILURE_MEMORY_AND_RECIPE_PREFLIGHT_POLICY.md",
      "router:20260924-121653-claude-io-ra-stand-up-the-ma-at-metal-scheduler-per-machine-reservations",
      "router:20260924-145757-claude-io-ra-ma-at-scheduler-2nd-foreign-run-collision-today-raise-priori",
      "router:20260924-195508-ra-claude-io-ma-at-metal-scheduler-live-on-both-macs"
    ]
  },
  "mirrors": {
    "repository": "current",
    "desktop": "pending",
    "workspace": "pending"
  },
  "next_action": "MAAT-WING-001.G1 DELIVERED: the metal reservation scheduler is built (sirsi-pantheon #781, internal/maat/schedule + `sirsi maat \u2026`), deployed M1+M5, and cross-host enforcement proven live (an M1 rail reservation refuses an M5 foreign reserve, exit 97). The local System One Casebook projects decision-journal records through `sirsi maat casebook` and the Horus Ma'at view; it is a source candidate until this exact wing record is accepted on origin/main and pinned by the universal Stack Lab registry. Open follow-ups: per-rail traffic detector (maat-02), additional bounded source adapters, and registry pinning."
}
